problem_id,source,target,prev_source,prev_target
mawps-219,Matthew gives Annie 36 more.,"transfer ( annie , matthew , 36 , crayon , None , None )",Annie starts with 4 crayons.,"container ( annie , 4 , crayon , None , None )"
mawps-219,How many crayons does Annie end with?,"container ( annie , None , crayon , None , None )",Matthew gives Annie 36 more.,"transfer ( annie , matthew , 36 , crayon , None , None )"
mawps-63,Lemon heads come in packages of 6.,"container ( world , None , lemon head , None , None )",,
mawps-63,Louis ate 54 Lemon Heads.,"container ( louis , 54 , lemon head , None , None )",Lemon heads come in packages of 6.,"container ( world , None , lemon head , None , None )"
mawps-63,How many whole boxes did he eat and how many Lemon Heads does he have left?,"rate ( louis , 6 , lemon  , head , None , box , None , None ) container ( louis , None , box , None , None )",Louis ate 54 Lemon Heads.,"container ( louis , 54 , lemon head , None , None )"
mawps-148,Sam had 98 pennies in his bank.,"container ( sam , 98 , money , None , penny )",,
mawps-148,He spent 93 of his pennies.,"transfer ( None , sam , 93 , money , None , penny )",Sam had 98 pennies in his bank.,"container ( sam , 98 , money , None , penny )"
mawps-148,How many pennies does he have now?,"container ( sam , None , money , None , penny )",He spent 93 of his pennies.,"transfer ( None , sam , 93 , money , None , penny )"
mawps-261,Darnel sprinted 0.875 lap and then took a break by jogging 0.75 lap.,"container ( darnel , 0.875 , distance , sprint , lap ) container ( darnel , 0.75 , distance , jogging , lap )",,
mawps-261,How much farther did Darnel sprint than jog?,"difference ( darnel , darnel , None , distance , sprint , lap , distance , jogging , lap )",Darnel sprinted 0.875 lap and then took a break by jogging 0.75 lap.,"container ( darnel , 0.875 , distance , sprint , lap ) container ( darnel , 0.75 , distance , jogging , lap )"
mawps-324,Dan has $3.,"container ( dan , 3 , money , None , $ )",,
mawps-324,He bought a candy bar for $1.,"transfer ( None , dan , 1 , money , None , $ )",Dan has $3.,"container ( dan , 3 , money , None , $ )"
mawps-324,How much money is left?,"container ( dan , None , money , None , $ )",He bought a candy bar for $1.,"transfer ( None , dan , 1 , money , None , $ )"
mawps-109,Sara goes fishing with Melanie.,,,
mawps-109,Sara catches 5 trout.,"container ( sara , 5 , trout , None , None )",Sara goes fishing with Melanie.,
mawps-109,Melanie catches 2 times as many trout as Sara.,"explicit ( melanie , sara , 2 , trout , None , None , trout , None , None )",Sara catches 5 trout.,"container ( sara , 5 , trout , None , None )"
mawps-109,How many trout did Melanie catch?,"container ( melanie , None , trout , None , None )",Melanie catches 2 times as many trout as Sara.,"explicit ( melanie , sara , 2 , trout , None , None , trout , None , None )"
mawps-220,The Silvergrove Public Library used a grant to purchase 2647 books.,"container ( silvergrove public library , 2647 , book , None , None )",,
mawps-220,Now the library has a total of 8582 books.,"container ( silvergrove public library , 8582 , book , None , None )",The Silvergrove Public Library used a grant to purchase 2647 books.,"container ( silvergrove public library , 2647 , book , None , None )"
mawps-220,How many books did the library have before the grant?,"transfer ( silvergrove public library , None , None , book , None , None )",Now the library has a total of 8582 books.,"container ( silvergrove public library , 8582 , book , None , None )"
mawps-365,Stephanie went to the store 8 times last month.,,,
mawps-365,She buys 2 oranges each time she goes to the store.,"container ( stephanie , 8 , store , None , None ) rate ( stephanie , 2 , orange , None , None , store , None , None )",Stephanie went to the store 8 times last month.,
mawps-365,How many oranges did Stephanie buy last month?,"container ( stephanie , None , orange , None , None )",She buys 2 oranges each time she goes to the store.,"container ( stephanie , 8 , store , None , None ) rate ( stephanie , 2 , orange , None , None , store , None , None )"
mawps-277,Sally had 760 quarters in her bank.,"container ( sally , 760 , money , None , quarter )",,
mawps-277,She spent 418 of her quarters.,"transfer ( None , sally , 418 , money , spent , quarter )",Sally had 760 quarters in her bank.,"container ( sally , 760 , money , None , quarter )"
mawps-277,How many quarters does she have now?,"container ( sally , None , money , None , quarter )",She spent 418 of her quarters.,"transfer ( None , sally , 418 , money , spent , quarter )"
mawps-332,"A company invited 24 people to a luncheon, but 10 of them didn't show up.","container ( company , 24 , people , None , None ) transfer ( None , company , 10 , people , None , None )",,
mawps-332,"If the tables they had held 7 people each,","rate ( company , 7 , people , None , None , table , None , None )","A company invited 24 people to a luncheon, but 10 of them didn't show up.","container ( company , 24 , people , None , None ) transfer ( None , company , 10 , people , None , None )"
mawps-332,how many tables do they need?,"container ( company , None , table , None , None )","If the tables they had held 7 people each,","rate ( company , 7 , people , None , None , table , None , None )"
mawps-349,Joan decided to sell all of her old books.,,,
mawps-349,She gathered up 33 books to sell.,"container ( joan , 33 , book , None , None )",Joan decided to sell all of her old books.,
mawps-349,She sold 26 books in a yard sale.,"transfer ( None , joan , 26 , book , yard sale , None )",She gathered up 33 books to sell.,"container ( joan , 33 , book , None , None )"
mawps-349,How many books does Joan now have?,"container ( joan , None , book , None , None )",She sold 26 books in a yard sale.,"transfer ( None , joan , 26 , book , yard sale , None )"
mawps-76,The junior ranger asked Christian to help him place 420 seedlings in packets.,"container ( junior ranger , 420 , seedling , None , packet )",,
mawps-76,"If every packet needs to contain 7 seeds,","rate ( junior ranger , 7 , seed , None , None , packet , None , None )",The junior ranger asked Christian to help him place 420 seedlings in packets.,"container ( junior ranger , 420 , seedling , None , packet )"
mawps-76,how many packets do they need?,"container ( junior ranger , None , packet , None , None )","If every packet needs to contain 7 seeds,","rate ( junior ranger , 7 , seed , None , None , packet , None , None )"
mawps-99,A store had 34 oranges in a bin.,"container ( store , 34 , orange , None , None )",,
mawps-99,If they threw away 20 of the old ones and put 13 new ones in the bin.,"transfer ( None , store , 20 , orange , None , None ) transfer ( store , None , 13 , orange , None , None )",A store had 34 oranges in a bin.,"container ( store , 34 , orange , None , None )"
mawps-99,how many would be in the bin?,"container ( store , None , orange , None , None )",If they threw away 20 of the old ones and put 13 new ones in the bin.,"transfer ( None , store , 20 , orange , None , None ) transfer ( store , None , 13 , orange , None , None )"
mawps-488,Roger had 16 dollars.,"container ( roger , 16 , money , None , dollar )",,
mawps-488,For his birthday he got 28 more dollars but spent 25 on a new game.,"transfer ( roger , None , 28 , money , birthday , dollar ) transfer ( None , roger , 25 , money , new game , dollar )",Roger had 16 dollars.,"container ( roger , 16 , money , None , dollar )"
mawps-488,How much money does he have now?,"container ( roger , None , money , None , dollar )",For his birthday he got 28 more dollars but spent 25 on a new game.,"transfer ( roger , None , 28 , money , birthday , dollar ) transfer ( None , roger , 25 , money , new game , dollar )"
mawps-172,Cody bought 7 boxes of chocolate candy and 3 boxes of caramel candy.,"container ( cody , 7 , candy , chocolate , box ) container ( cody , 3 , candy , caramel , box )",,
mawps-172,"If each box has 8 pieces inside it,","container ( cody , None , candy , None , piece )",Cody bought 7 boxes of chocolate candy and 3 boxes of caramel candy.,"container ( cody , 7 , candy , chocolate , box ) container ( cody , 3 , candy , caramel , box )"
mawps-172,how much candy did he have total?,"container ( cody , None , candy , None , box ) part ( cody , candy , None , box , cody , candy , chocolate , box , cody , candy , caramel , box ) rate ( cody , 8 , candy , None , piece , candy , None , box ) container ( cody , None , candy , None , piece )","If each box has 8 pieces inside it,","container ( cody , None , candy , None , piece )"
mawps-21,"A study reported that in a random sampling of 100 women over the age of 35, 8 of the women were married 2 or more times.","container ( study , 100 , women , over age of 35 , None ) container ( study , 8 , women , married 2 or more times , None )",,
mawps-21,"Based on the study results,",,"A study reported that in a random sampling of 100 women over the age of 35, 8 of the women were married 2 or more times.","container ( study , 100 , women , over age of 35 , None ) container ( study , 8 , women , married 2 or more times , None )"
mawps-21,how many woman in a group of 5000 women over the age of 35 would likely be married 2 or more times?,"container ( study , 5000 , women , over the age of 35 , None ) rate ( study , 2/25 , women , married 2 or more times , None , women , None , None ) container ( study , None , women , married 2 or more times , None )","Based on the study results,",
mawps-1,There are 139 erasers and 118 scissors in the drawer.,"container ( drawer , 139 , eraser , None , None ) container ( drawer , 118 , scissor , None , None )",,
mawps-1,Jason placed 131 erasers in the drawer.,"transfer ( drawer , None , 131 , eraser , Joan placed , None )",There are 139 erasers and 118 scissors in the drawer.,"container ( drawer , 139 , eraser , None , None ) container ( drawer , 118 , scissor , None , None )"
mawps-1,How many erasers are now there in total?,"container ( drawer , None , eraser , None , None )",Jason placed 131 erasers in the drawer.,"transfer ( drawer , None , 131 , eraser , Joan placed , None )"
mawps-164,A construction company is repaving a damaged road.,,,
mawps-164,"So far, they have repaved a total of 4938 inches of the road.","container ( construction company , 4938 , road , None , inch )",A construction company is repaving a damaged road.,
mawps-164,"Today, they repaved 805 inches of the road.","container ( construction company , 805 , road , today , inch )","So far, they have repaved a total of 4938 inches of the road.","container ( construction company , 4938 , road , None , inch )"
mawps-164,How many inches of the road had they repaved before today?,"container ( construction company , None , road , before today , inch ) part ( construction company , road , None , inch , construction company , road , today , inch , construction company , road , before today , inch )","Today, they repaved 805 inches of the road.","container ( construction company , 805 , road , today , inch )"
mawps-308,Jason has 3 Pokemon cards.,"container ( jason , 3 , card , Pokemon , None )",,
mawps-308,Benny bought 2 of Jason's Pokemon cards.,"transfer ( benny , jason , 2 , card , Pokemon , None )",Jason has 3 Pokemon cards.,"container ( jason , 3 , card , Pokemon , None )"
mawps-308,How many Pokemon cards does Jason have now?,"container ( jason , None , card , Pokemon , None )",Benny bought 2 of Jason's Pokemon cards.,"transfer ( benny , jason , 2 , card , Pokemon , None )"
mawps-37,Mike had 34 peaches at his roadside fruit dish.,"container ( mike , 34 , peach , roadside fruit dish , None )",,
mawps-37,He went to the orchard and picked peaches to stock up.,"transfer ( mike , None , None , peach , orchard , None )",Mike had 34 peaches at his roadside fruit dish.,"container ( mike , 34 , peach , roadside fruit dish , None )"
mawps-37,There are now 86 peaches.,"container ( mike , 86 , peach , None , None )",He went to the orchard and picked peaches to stock up.,"transfer ( mike , None , None , peach , orchard , None )"
mawps-37,how many did he pick?,"transfer ( mike , None , None , peach , orchard , None )",There are now 86 peaches.,"container ( mike , 86 , peach , None , None )"
mawps-133,A waitress put leftover tarts into the fridge on Thursday night.,,,
mawps-133,"She noticed that the restaurant had 1/12 tart filled with cherries, 0.75 tart filled with blueberries, and 1/12 tart filled with peaches.","container ( tart , 1/12 , Cherry , None , None ) container ( tart , 0.75 , Blueberry , None , None ) container ( tart , 1/12 , Peach , None , None )",A waitress put leftover tarts into the fridge on Thursday night.,
mawps-133,How many leftover tarts did the restaurant have in all?,"container ( tart , None , leftover , None , None ) part ( tart , leftover , None , None , tart , Cherry , None , None , tart , Blueberry , None , None , tart , Peach , None , None )","She noticed that the restaurant had 1/12 tart filled with cherries, 0.75 tart filled with blueberries, and 1/12 tart filled with peaches.","container ( tart , 1/12 , Cherry , None , None ) container ( tart , 0.75 , Blueberry , None , None ) container ( tart , 1/12 , Peach , None , None )"
mawps-60,"Mike found 6 seashells and 4 starfish, but 4 of the seashells were broken.","container ( mike , 6 , seashell , None , None ) container ( mike , 4 , starfish , None , None ) container ( mike , 4 , seashell , broken , None ) part ( mike , mike , seashell , None , None , seashell , broken , None )",,
mawps-60,How many unbroken seashells did Mike find?,"container ( mike , None , seashell , unbroken , None ) part ( mike , seashell , None , None , mike , seashell , unbroken , None )","Mike found 6 seashells and 4 starfish, but 4 of the seashells were broken.","container ( mike , 6 , seashell , None , None ) container ( mike , 4 , starfish , None , None ) container ( mike , 4 , seashell , broken , None ) part ( mike , mike , seashell , None , None , seashell , broken , None )"
mawps-328,Jenny sold 24 boxes of Trefoils.,"container ( jenny , 24 , box , Trefoils , None )",,
mawps-328,"How many cases of 8 boxes, plus extra boxes does Jenny need to deliver?","rate ( jenny , 8 , box , None , None , case , None , None ) container ( jenny , None , case , Trefoils , None )",Jenny sold 24 boxes of Trefoils.,"container ( jenny , 24 , box , Trefoils , None )"
mawps-17,James has 232 balloons.,"container ( james , 232 , balloon , None , None )",,
mawps-17,Amy has 101 balloons.,"container ( amy , 101 , balloon , None , None )",James has 232 balloons.,"container ( james , 232 , balloon , None , None )"
mawps-17,How many more balloons does James have than Amy?,"difference ( james , amy , None , balloon , None , None , balloon , None , None )",Amy has 101 balloons.,"container ( amy , 101 , balloon , None , None )"
mawps-113,Jennifer has 72 cards.,"container ( jennifer , 72 , card , None , None )",,
mawps-113,61 are eaten by a hippopotamus.,"transfer ( None , jennifer , 61 , card , hippopotamus , None )",Jennifer has 72 cards.,"container ( jennifer , 72 , card , None , None )"
mawps-113,How many cards will Jennifer have?,"container ( jennifer , None , card , None , None )",61 are eaten by a hippopotamus.,"transfer ( None , jennifer , 61 , card , hippopotamus , None )"
mawps-1368,A cereal box holds 18 cups of cereal.,"container ( cereal box , 18 , Cup , None , None )",,
mawps-1368,Each serving is 2 cups.,"rate ( cereal box , 1/2 , Cup , None , None , Serving , None , None )",A cereal box holds 18 cups of cereal.,"container ( cereal box , 18 , Cup , None , None )"
mawps-1368,How many servings are in the whole box?,"container ( cereal box , None , Serving , None , None )",Each serving is 2 cups.,"rate ( cereal box , 1/2 , Cup , None , None , Serving , None , None )"
mawps-56,An oil pipe in the sea broke.,,,
mawps-56,"Before engineers started to fix the pipe, 2475 gallons of oil leaked into the water.","container ( sea , 2475 , oil , None , gallon )",An oil pipe in the sea broke.,
mawps-56,A total of 6206 gallons of oil leaked before the pipe was fixed.,"container ( sea , 6206 , oil , None , gallon )","Before engineers started to fix the pipe, 2475 gallons of oil leaked into the water.","container ( sea , 2475 , oil , None , gallon )"
mawps-56,How many gallons of oil leaked while the engineers were fixing the pipe?,"transfer ( sea , None , None , oil , None , gallon )",A total of 6206 gallons of oil leaked before the pipe was fixed.,"container ( sea , 6206 , oil , None , gallon )"
mawps-105,"A trivia team had 5 members total, but during a game 2 members didn't show up.","container ( team , 5 , member , None , None ) transfer ( None , team , 2 , member , None , None )",,
mawps-105,"If each member that did show up scored 6 points,","rate ( team , 6 , point , None , None , member , None , None )","A trivia team had 5 members total, but during a game 2 members didn't show up.","container ( team , 5 , member , None , None ) transfer ( None , team , 2 , member , None , None )"
mawps-105,how many points were scored total?,"container ( team , None , point , None , None )","If each member that did show up scored 6 points,","rate ( team , 6 , point , None , None , member , None , None )"
mawps-294,"A trivia team had 15 members total, but during a game 6 members didn't show up.","container ( trivia team , 15 , member , None , None ) transfer ( None , trivia team , 6 , member , None , None )",,
mawps-294,"If each member that did show up scored 3 points,","rate ( trivia team , 3 , point , None , None , member , None , None )","A trivia team had 15 members total, but during a game 6 members didn't show up.","container ( trivia team , 15 , member , None , None ) transfer ( None , trivia team , 6 , member , None , None )"
mawps-294,how many points were scored total?,"container ( trivia team , None , point , None , None )","If each member that did show up scored 3 points,","rate ( trivia team , 3 , point , None , None , member , None , None )"
mawps-152,Lewis saved checking on the grapevines for his last stop.,,,
mawps-152,He was told by one of the pickers that they fill 324 drums of grapes per day.,"rate ( lewis , 324 , grape , None , drum , time , None , day )",Lewis saved checking on the grapevines for his last stop.,
mawps-152,How many drums of grapes would be filled in 9 days?,"container ( lewis , 9 , time , None , day ) container ( lewis , None , grape , None , drum )",He was told by one of the pickers that they fill 324 drums of grapes per day.,"rate ( lewis , 324 , grape , None , drum , time , None , day )"
mawps-1016,2 birds were sitting on the fence.,"container ( fence , 2 , bird , None , None )",,
mawps-1016,4 more birds came to join them.,"transfer ( fence , None , 4 , bird , None , None )",2 birds were sitting on the fence.,"container ( fence , 2 , bird , None , None )"
mawps-1016,How many birds are sitting on the fence?,"container ( world , 2 , bird , fence , None ) transfer ( world , None , 4 , bird , None , None ) container ( world , None , bird , fence , None )",4 more birds came to join them.,"transfer ( fence , None , 4 , bird , None , None )"
mawps-345,A new building needed 11 windows.,"container ( building , 11 , window , None , None )",,
mawps-345,The builder had already installed 4 of them.,"transfer ( None , building , 4 , window , None , None )",A new building needed 11 windows.,"container ( building , 11 , window , None , None )"
mawps-345,"If it takes 8 hours to install each window,","container ( building , None , time , None , hour )",The builder had already installed 4 of them.,"transfer ( None , building , 4 , window , None , None )"
mawps-345,how long will it take him to install the rest?,"rate ( building , 8 , time , None , hour , window , None , None ) container ( building , None , time , None , hour )","If it takes 8 hours to install each window,","container ( building , None , time , None , hour )"
mawps-95,Harold has 53 marbles.,"container ( harold , 53 , marble , None , None )",,
mawps-95,He gets 16 more from Steve.,"transfer ( harold , steve , 16 , marble , None , None )",Harold has 53 marbles.,"container ( harold , 53 , marble , None , None )"
mawps-95,How many marbles does Harold have in all?,"container ( harold , None , marble , None , None )",He gets 16 more from Steve.,"transfer ( harold , steve , 16 , marble , None , None )"
mawps-129,Sarah had 4 pages of math homework and 6 pages of reading homework.,"container ( sarah , 4 , homework , math , page ) container ( sarah , 6 , homework , reading , page )",,
mawps-129,"If each page had 4 problems on it,","container ( sarah , None , homework , None , page ) part ( sarah , homework , None , page , sarah , homework , math , page , sarah , homework , reading , page ) container ( sarah , None , problem , None , page )",Sarah had 4 pages of math homework and 6 pages of reading homework.,"container ( sarah , 4 , homework , math , page ) container ( sarah , 6 , homework , reading , page )"
mawps-129,how many problems did she have to complete total?,"rate ( sarah , 4 , problem , None , None , homework , None , page ) container ( sarah , None , problem , None , page )","If each page had 4 problems on it,","container ( sarah , None , homework , None , page ) part ( sarah , homework , None , page , sarah , homework , math , page , sarah , homework , reading , page ) container ( sarah , None , problem , None , page )"
mawps-312,Luke was selling his old games.,,,
mawps-312,He started out with 39 but sold 19 of them.,"container ( luke , 39 , game , None , None ) transfer ( None , luke , 19 , game , sold , None )",Luke was selling his old games.,
mawps-312,He packed the rest up putting 4 games into each box.,"rate ( luke , 4 , game , None , None , box , None , None )",He started out with 39 but sold 19 of them.,"container ( luke , 39 , game , None , None ) transfer ( None , luke , 19 , game , sold , None )"
mawps-312,How many boxes did he have to use?,"container ( luke , None , box , None , None )",He packed the rest up putting 4 games into each box.,"rate ( luke , 4 , game , None , None , box , None , None )"
mawps-191,"The value of a sport utility vehicle this year is 16000 dollars, which is 0.8 of what its value was last year.","container ( sport utility vehicle , 16000 , value , this year , dollar ) explicit ( sport utility vehicle , sport utility vehicle , 0.8 , value , this year , dollar , value , last year , dollar )",,
mawps-191,Find the value of the vehicle last year.,"container ( sport utility vehicle , None , value , last year , dollar )","The value of a sport utility vehicle this year is 16000 dollars, which is 0.8 of what its value was last year.","container ( sport utility vehicle , 16000 , value , this year , dollar ) explicit ( sport utility vehicle , sport utility vehicle , 0.8 , value , this year , dollar , value , last year , dollar )"
mawps-304,Sam had 10 socks.,"container ( sam , 10 , sock , None , None )",,
mawps-304,"If he threw away 3 old ones that didn't fit and bought 36 new ones,","transfer ( None , sam , 3 , shirt , old , None ) transfer ( sam , None , 36 , shirt , new , None )",Sam had 10 socks.,"container ( sam , 10 , sock , None , None )"
mawps-304,how many socks would he have?,"container ( sam , None , sock , None , None )","If he threw away 3 old ones that didn't fit and bought 36 new ones,","transfer ( None , sam , 3 , shirt , old , None ) transfer ( sam , None , 36 , shirt , new , None )"
mawps-241,"On a hot day, Sam poured 1 bucket of water into a plastic wading pool.","container ( sam , 1 , water , plastic wading pool , bucket )",,
mawps-241,A few minutes later he added another 8.8 buckets.,"transfer ( sam , None , 8.8 , water , None , bucket )","On a hot day, Sam poured 1 bucket of water into a plastic wading pool.","container ( sam , 1 , water , plastic wading pool , bucket )"
mawps-241,How much water did Sam pour into the pool?,"container ( sam , None , water , None , bucket )",A few minutes later he added another 8.8 buckets.,"transfer ( sam , None , 8.8 , water , None , bucket )"
mawps-168,Fred has 5 baseball cards.,"container ( fred , 5 , card , baseball , None )",,
mawps-168,Melanie bought 3 of Fred's baseball cards.,"transfer ( melanie , fred , 3 , card , baseball , None )",Fred has 5 baseball cards.,"container ( fred , 5 , card , baseball , None )"
mawps-168,How many baseball cards does Fred have now?,"container ( fred , None , card , baseball , None )",Melanie bought 3 of Fred's baseball cards.,"transfer ( melanie , fred , 3 , card , baseball , None )"
mawps-187,Sandy went to the mall to buy clothes.,,,
mawps-187,"She spent $13.99 on shorts, $12.14 on a shirt, and $7.43 on a jacket.","container ( sandy , 13.99 , money , shorts , $ ) container ( sandy , 12.14 , money , shirt , $ ) container ( sandy , 7.43 , money , jacket , $ )",Sandy went to the mall to buy clothes.,
mawps-187,How much money did Sandy spend on clothes?,"container ( sandy , None , money , clothes , $ ) part ( sandy , money , clothes , $ , sandy , money , shorts , $ , sandy , money , shirt , $ , sandy , money , jacket , $ )","She spent $13.99 on shorts, $12.14 on a shirt, and $7.43 on a jacket.","container ( sandy , 13.99 , money , shorts , $ ) container ( sandy , 12.14 , money , shirt , $ ) container ( sandy , 7.43 , money , jacket , $ )"
mawps-353,"Dave was helping the cafeteria workers pick up lunch trays, but he could only carry 9 trays at a time.","rate ( dave , 9 , tray , None , None , occasion , None , None )",,
