problem_id,source,target,prev_source,prev_target
mawps-87,"In a bag there are 13 red marbles, 5 blue marbles, and 7 green marbles.","container ( bag , 13 , marble , red , None ) container ( bag , 5 , marble , blue , None ) container ( bag , 7 , marble , green , None )",,
mawps-87,What percent of the marbles are green?,"container ( bag , None , marble , None , None ) part ( bag , marble , None , None , bag , marble , red , None , bag , marble , blue , None , bag , marble , green , None ) explicit ( bag , bag , None , marble , green , None , marble , None , None )","In a bag there are 13 red marbles, 5 blue marbles, and 7 green marbles.","container ( bag , 13 , marble , red , None ) container ( bag , 5 , marble , blue , None ) container ( bag , 7 , marble , green , None )"
mawps-212,Each chocolate bar in a box cost $4.,"rate ( world , 4 , cost , None , $ , chocolate bar , None , None )",,
mawps-212,"If a box had 11 bars total and Vanessa sold all but 7 bars,","container ( world , 11 , chocolate bar , box , None ) transfer ( None , world , 7 , chocolate bar , Vanessa , None )",Each chocolate bar in a box cost $4.,"rate ( world , 4 , cost , None , $ , chocolate bar , None , None )"
mawps-212,how much money would she have made?,"container ( world , None , cost , None , $ )","If a box had 11 bars total and Vanessa sold all but 7 bars,","container ( world , 11 , chocolate bar , box , None ) transfer ( None , world , 7 , chocolate bar , Vanessa , None )"
mawps-357,There were 2 friends playing a video game online when 2 more players joined the game.,"container ( game , 2 , friend , None , None ) transfer ( game , None , 2 , friend , None , None )",,
mawps-357,"If each player had 3 lives,","rate ( game , 3 , lives , None , None , player , None , None )",There were 2 friends playing a video game online when 2 more players joined the game.,"container ( game , 2 , friend , None , None ) transfer ( game , None , 2 , friend , None , None )"
mawps-357,how many lives did they have total?,"container ( game , None , lives , None , None )","If each player had 3 lives,","rate ( game , 3 , lives , None , None , player , None , None )"
mawps-68,A pet store has 9 bird cages.,"container ( pet store , 9 , cage , None , None )",,
mawps-68,"If each cage has 2 parrots and 6 parakeets in it,","rate ( pet store , 2 , bird , parrot , None , cage , None , None ) rate ( pet store , 6 , bird , parakeet , None , cage , None , None )",A pet store has 9 bird cages.,"container ( pet store , 9 , cage , None , None )"
mawps-68,how many birds does the pet store have total?,"container ( pet store , None , bird , None , None ) part ( pet store , bird , None , None , pet store , bird , parrot , None , pet store , bird , parakeet , None )","If each cage has 2 parrots and 6 parakeets in it,","rate ( pet store , 2 , bird , parrot , None , cage , None , None ) rate ( pet store , 6 , bird , parakeet , None , cage , None , None )"
mawps-183,There is 1/6 cup of oil in Scarlett's measuring cup.,"container ( scarlett , 1/6 , oil , None , cup )",,
mawps-183,"If Scarlett adds 2/3 cup more,","transfer ( scarlett , None , 2/3 , oil , None , cup )",There is 1/6 cup of oil in Scarlett's measuring cup.,"container ( scarlett , 1/6 , oil , None , cup )"
mawps-183,how much oil will be in the measuring cup?,"container ( scarlett , None , oil , None , cup )","If Scarlett adds 2/3 cup more,","transfer ( scarlett , None , 2/3 , oil , None , cup )"
mawps-245,"Each year, salmon travel upstream, going from the ocean to the rivers where they were born.",,,
mawps-245,"This year, 712261 male and 259378 female salmon returned to their rivers.","container ( river , 712261 , salmon , male , None ) container ( river , 259378 , salmon , female , None )","Each year, salmon travel upstream, going from the ocean to the rivers where they were born.",
mawps-245,How many salmon made the trip?,"container ( river , None , salmon , None , None ) part ( river , salmon , None , None , river , salmon , male , None , river , salmon , female , None )","This year, 712261 male and 259378 female salmon returned to their rivers.","container ( river , 712261 , salmon , male , None ) container ( river , 259378 , salmon , female , None )"
mawps-300,"Tim got 3 nickels and 13 dimes for shining shoes, and in his tip jar found 7 dimes and 9 half-dollars.","container ( tim , 3 , money , shining shoes , nickel ) container ( tim , 13 , money , shining shoes , dime ) container ( tim , 7 , money , tip jar , dime ) container ( tim , 9 , money , tip jar , half-dollar )",,
mawps-300,How much money did Tim get?,"explicit ( tim , tim , 0.05 , money , None , dollar , money , shining shoes , nickel ) explicit ( tim , tim , 0.1 , money , None , dollar , money , shining shoes , dime ) explicit ( tim , tim , 0.1 , money , None , dollar , money , tip jar , dime ) explicit ( tim , tim , 0.1 , money , None , dollar , money , tip jar , half-dollar ) container ( tim , None , money , None , dollar )","Tim got 3 nickels and 13 dimes for shining shoes, and in his tip jar found 7 dimes and 9 half-dollars.","container ( tim , 3 , money , shining shoes , nickel ) container ( tim , 13 , money , shining shoes , dime ) container ( tim , 7 , money , tip jar , dime ) container ( tim , 9 , money , tip jar , half-dollar )"
mawps-195,"To fill an order, the factory dyed 61921 yards of silk green and 49500 yards pink.","container ( factory , 61291 , silk , green , yard ) container ( factory , 49500 , silk , pink , yard )",,
mawps-195,How many yards of silk did it dye for that order?,"container ( factory , None , silk , None , yard ) part ( factory , silk , None , yard , factory , silk , green , yard , factory , silk , pink , yard )","To fill an order, the factory dyed 61921 yards of silk green and 49500 yards pink.","container ( factory , 61291 , silk , green , yard ) container ( factory , 49500 , silk , pink , yard )"
mawps-316,A painter needed to paint 12 rooms in a building.,"container ( painter , 12 , room , None , None )",,
mawps-316,Each room takes 3 hours to paint.,"rate ( painter , 3 , time , None , hour , room , None , None )",A painter needed to paint 12 rooms in a building.,"container ( painter , 12 , room , None , None )"
mawps-316,"If he already painted 4 rooms,","transfer ( None , painter , 4 , room , None , None )",Each room takes 3 hours to paint.,"rate ( painter , 3 , time , None , hour , room , None , None )"
mawps-316,how much longer will he take to paint the rest?,"container ( painter , None , time , None , hour )","If he already painted 4 rooms,","transfer ( None , painter , 4 , room , None , None )"
mawps-29,Christine wandered 20 miles at 4 miles per hour.,"container ( christine , 20 , distance , None , mile ) rate ( christine , 4 , distance , None , hour , time , None , hour )",,
mawps-29,How long did Christine wander?,"container ( christine , None , time , None , hour )",Christine wandered 20 miles at 4 miles per hour.,"container ( christine , 20 , distance , None , mile ) rate ( christine , 4 , distance , None , hour , time , None , hour )"
mawps-204,Benny picked 2 apples from the apple tree.,"container ( benny , 2 , apple , None , None )",,
mawps-204,Dan picked 9 apples from the apple tree.,"container ( dan , 9 , apple , None , None )",Benny picked 2 apples from the apple tree.,"container ( benny , 2 , apple , None , None )"
mawps-204,How many apples were picked in total?,"container ( world , None , apple , None , None ) part ( world , apple , None , None , benny , apple , None , None , dan , apple , None , None )",Dan picked 9 apples from the apple tree.,"container ( dan , 9 , apple , None , None )"
mawps-91,At a company picnic 9 managers and 15 employees decided to start a game of volleyball.,"container ( company , 9 , manager , None , None ) container ( company , 15 , employee , None , None )",,
mawps-91,If they split into 8 teams.,"container ( company , 8 , team , None , None )",At a company picnic 9 managers and 15 employees decided to start a game of volleyball.,"container ( company , 9 , manager , None , None ) container ( company , 15 , employee , None , None )"
mawps-91,how many people would be on each team?,"container ( company , None , people , None , None ) part ( company , people , None , None , company , manager , None , None , company , employee , None , None ) rate ( company , None , people , None , None , team , None , None )",If they split into 8 teams.,"container ( company , 8 , team , None , None )"
mawps-341,Tim found 679 seashells and 110 starfish on the beach.,"container ( tim , 679 , seashell , None , None ) container ( tim , 110 , starfish , None , None )",,
mawps-341,He gave 172 of the seashells to Sara.,"transfer ( sara , tim , 172 , seashell , None , None )",Tim found 679 seashells and 110 starfish on the beach.,"container ( tim , 679 , seashell , None , None ) container ( tim , 110 , starfish , None , None )"
mawps-341,How many seashells does Tim now have?,"container ( tim , None , seashell , None , None )",He gave 172 of the seashells to Sara.,"transfer ( sara , tim , 172 , seashell , None , None )"
mawps-156,Joan has 8 orange balloons but lost 2 of them.,"container ( joan , 8 , balloon , orange , None ) transfer ( None , joan , 2 , balloon , orange , None )",,
mawps-156,How many orange balloons does Joan have now?,"container ( joan , None , balloon , orange , None )",Joan has 8 orange balloons but lost 2 of them.,"container ( joan , 8 , balloon , orange , None ) transfer ( None , joan , 2 , balloon , orange , None )"
mawps-101,A magician was selling magic card decks for 9 dollars each.,"container ( magician , None , money , None , dollar )",,
mawps-101,"If he started with 12 decks and by the end of the day he had 7 left,","container ( magician , 12 , deck , magic , None ) container ( magician , 7 , deck , magic , None ) transfer ( None , magician , None , deck , magic , None ) rate ( magician , 9 , money , None , dollar , deck , magic , None )",A magician was selling magic card decks for 9 dollars each.,"container ( magician , None , money , None , dollar )"
mawps-101,how much money did he earn?,"container ( magician , None , money , None , dollar )","If he started with 12 decks and by the end of the day he had 7 left,","container ( magician , 12 , deck , magic , None ) container ( magician , 7 , deck , magic , None ) transfer ( None , magician , None , deck , magic , None ) rate ( magician , 9 , money , None , dollar , deck , magic , None )"
mawps-117,Larry starts with 91 cards.,"container ( larry , 91 , card , None , None )",,
mawps-117,17 are eaten by a hippopotamus.,"transfer ( None , larry , 17 , card , hippopotamus , None )",Larry starts with 91 cards.,"container ( larry , 91 , card , None , None )"
mawps-117,How many cards does Larry end with?,"container ( larry , None , card , None , None )",17 are eaten by a hippopotamus.,"transfer ( None , larry , 17 , card , hippopotamus , None )"
mawps-44,Paul had saved up 4 dollars.,"container ( paul , 4 , money , None , dollar )",,
mawps-44,"If he received another 11 dollars for his allowance,","transfer ( paul , None , 11 , money , allowance , dollar )",Paul had saved up 4 dollars.,"container ( paul , 4 , money , None , dollar )"
mawps-44,how many 5 dollar toys could he buy?,"rate ( paul , 5 , money , None , dollar , toy , None , None ) container ( paul , None , toy , None , None )","If he received another 11 dollars for his allowance,","transfer ( paul , None , 11 , money , allowance , dollar )"
mawps-510,"While making desserts for a bake sale, Victor used 0.625 scoop of brown sugar as well as 0.25 scoop of white sugar.","container ( victor , 0.625 , sugar , brown , scoop ) container ( victor , 0.25 , sugar , white , scoop )",,
mawps-510,How much more brown sugar did Victor use?,"difference ( victor , victor , None , sugar , brown , scoop , sugar , white , scoop )","While making desserts for a bake sale, Victor used 0.625 scoop of brown sugar as well as 0.25 scoop of white sugar.","container ( victor , 0.625 , sugar , brown , scoop ) container ( victor , 0.25 , sugar , white , scoop )"
mawps-140,Bianca was planting vegetables in her garden.,,,
mawps-140,She started with 52 seeds and planted 40 of them in the big garden and in each of her small gardens put 2 seeds each.,"container ( bianca , 52 , seed , None , None ) container ( bianca , 40 , seed , big garden , None ) container ( bianca , None , seed , small garden , None ) part ( bianca , seed , None , None , bianca , seed , big garden , None , bianca , seed , small garden , None ) container ( bianca , None , garden , small , None ) rate ( bianca , 2 , seed , None , None , garden , small , None )",Bianca was planting vegetables in her garden.,
mawps-140,How many small gardens did Bianca have?,"container ( bianca , None , garden , small , None )",She started with 52 seeds and planted 40 of them in the big garden and in each of her small gardens put 2 seeds each.,"container ( bianca , 52 , seed , None , None ) container ( bianca , 40 , seed , big garden , None ) container ( bianca , None , seed , small garden , None ) part ( bianca , seed , None , None , bianca , seed , big garden , None , bianca , seed , small garden , None ) container ( bianca , None , garden , small , None ) rate ( bianca , 2 , seed , None , None , garden , small , None )"
mawps-13,Sean has 9 apples.,"container ( sean , 9 , apple , None , None )",,
mawps-13,Susan gives Sean 8 more.,"transfer ( sean , susan , 8 , apple , None , None )",Sean has 9 apples.,"container ( sean , 9 , apple , None , None )"
mawps-13,"Later, Sean buys 18 tickets at the store.","transfer ( sean , None , 18 , ticket , None , None )",Susan gives Sean 8 more.,"transfer ( sean , susan , 8 , apple , None , None )"
mawps-13,How many apples does Sean have in all?,"container ( sean , None , apple , None , None )","Later, Sean buys 18 tickets at the store.","transfer ( sean , None , 18 , ticket , None , None )"
mawps-269,"On Saturday, Sara spent $10.62 each on 2 tickets to a movie theater.","container ( sara , 2 , ticket , None , None ) rate ( sara , 10.62 , money , None , $ , ticket , None , None )",,
mawps-269,"Sara also rented a movie for $1.59, and bought a movie for $13.95.","container ( sara , 1.59 , money , rented a movie , $ ) container ( sara , 13.95 , money , bought a movie , $ )","On Saturday, Sara spent $10.62 each on 2 tickets to a movie theater.","container ( sara , 2 , ticket , None , None ) rate ( sara , 10.62 , money , None , $ , ticket , None , None )"
mawps-269,How much money in total did Sara spend on movies?,"container ( sara , None , money , None , $ ) part ( sara , money , None , $ , sara , money , None , $ , sara , money , rented a movie , $ , sara , money , bought a movie , $ )","Sara also rented a movie for $1.59, and bought a movie for $13.95.","container ( sara , 1.59 , money , rented a movie , $ ) container ( sara , 13.95 , money , bought a movie , $ )"
mawps-137,Joan's cat had 8 kittens.,"container ( joan's cat , 8 , kitten , None , None )",,
mawps-137,She gave 2 to her friends.,"transfer ( None , joan's cat , 2 , kitten , None , None )",Joan's cat had 8 kittens.,"container ( joan's cat , 8 , kitten , None , None )"
mawps-137,How many kittens does she have now?,"container ( joan's cat , None , kitten , None , None )",She gave 2 to her friends.,"transfer ( None , joan's cat , 2 , kitten , None , None )"
mawps-249,A restaurant served 9 pizzas during lunch and 6 during dinner today.,"container ( restaurant , 9 , pizza , lunch , None ) container ( restaurant , 6 , pizza , dinner , None )",,
mawps-249,How many pizzas were served today?,"container ( restaurant , None , pizza , None , None ) part ( restaurant , pizza , None , None , restaurant , pizza , lunch , None , restaurant , pizza , dinner , None )",A restaurant served 9 pizzas during lunch and 6 during dinner today.,"container ( restaurant , 9 , pizza , lunch , None ) container ( restaurant , 6 , pizza , dinner , None )"
mawps-33,Lino picked up 292 shells at the seashore in the morning and 324 shells in the afternoon.,"container ( lino , 292 , shell , morning , None ) container ( lino , 324 , shell , afternoon , None )",,
mawps-33,How many shells did he pick up in all?,"container ( lino , None , shell , None , None ) part ( lino , shell , None , None , lino , shell , morning , None , lino , shell , afternoon , None )",Lino picked up 292 shells at the seashore in the morning and 324 shells in the afternoon.,"container ( lino , 292 , shell , morning , None ) container ( lino , 324 , shell , afternoon , None )"
mawps-25,Sandy sold lemonade in her neighborhood.,,,
mawps-25,She got 17 half-dollars on Saturday and 6 half-dollars on Sunday.,"container ( sandy , 17/2 , money , Saturday , dollar ) container ( sandy , 3 , money , Sunday , dollar ) container ( sandy , None , money , Sunday , dollar ) part ( sandy , money , Sunday , dollar , sandy , money , Saturday , dollar , sandy , money , Sunday , dollar )",Sandy sold lemonade in her neighborhood.,
mawps-25,What amount of money did Sandy receive?,"container ( sandy , None , money , Sunday , dollar )",She got 17 half-dollars on Saturday and 6 half-dollars on Sunday.,"container ( sandy , 17/2 , money , Saturday , dollar ) container ( sandy , 3 , money , Sunday , dollar ) container ( sandy , None , money , Sunday , dollar ) part ( sandy , money , Sunday , dollar , sandy , money , Saturday , dollar , sandy , money , Sunday , dollar )"
mawps-5,Maggi had 3 packages of cupcakes.,"container ( maggi , 3 , package , cupcake , None )",,
mawps-5,There are 4 cupcakes in each package.,"rate ( maggi , 4 , cupcake , None , None , package , None , None )",Maggi had 3 packages of cupcakes.,"container ( maggi , 3 , package , cupcake , None )"
mawps-5,She ate 5 cupcakes.,"transfer ( None , maggi , 5 , cupcake , None , None )",There are 4 cupcakes in each package.,"rate ( maggi , 4 , cupcake , None , None , package , None , None )"
mawps-5,How many are left?,"container ( maggi , None , cupcake , None , None )",She ate 5 cupcakes.,"transfer ( None , maggi , 5 , cupcake , None , None )"
mawps-199,Some insects called aphids attack a large farm.,,,
mawps-199,"In response, the farmer releases ladybugs onto the fields.",,Some insects called aphids attack a large farm.,
mawps-199,There are 12170 ladybugs with spots and 54912 ladybugs without spots.,"container ( world , 12170 , ladybug , spot , None ) container ( world , 54912 , ladybug , without spot , None )","In response, the farmer releases ladybugs onto the fields.",
mawps-199,How many ladybugs are there in all?,"container ( world , None , ladybug , None , None ) part ( world , ladybug , None , None , world , ladybug , spot , None , world , ladybug , without spot , None )",There are 12170 ladybugs with spots and 54912 ladybugs without spots.,"container ( world , 12170 , ladybug , spot , None ) container ( world , 54912 , ladybug , without spot , None )"
mawps-208,Each chocolate bar in a box cost $2.,"rate ( world , 2 , cost , None , $ , chocolate bar , None , None )",,
mawps-208,"If a box had 13 bars total and Rachel sold all but 4 bars,","container ( world , 13 , chocolate bar , box , None ) container ( world , 4 , chocolate bar , box , None ) transfer ( None , world , None , chocolate bar , Rachel , None )",Each chocolate bar in a box cost $2.,"rate ( world , 2 , cost , None , $ , chocolate bar , None , None )"
mawps-208,how much money would she have made?,"rate ( world , 2 , cost , None , $ , chocolate bar , None , None ) container ( world , None , cost , None , $ )","If a box had 13 bars total and Rachel sold all but 4 bars,","container ( world , 13 , chocolate bar , box , None ) container ( world , 4 , chocolate bar , box , None ) transfer ( None , world , None , chocolate bar , Rachel , None )"
mawps-658,A waiter had 33 customers to wait on.,"container ( waiter , 33 , Customer , None , None )",,
mawps-658,"If 31 customers left and he got another 26 customers,","transfer ( None , waiter , 31 , Customer , None , None ) transfer ( waiter , None , 26 , Customer , None , None )",A waiter had 33 customers to wait on.,"container ( waiter , 33 , Customer , None , None )"
mawps-658,how many customers would he have?,"container ( waiter , None , Customer , None , None )","If 31 customers left and he got another 26 customers,","transfer ( None , waiter , 31 , Customer , None , None ) transfer ( waiter , None , 26 , Customer , None , None )"
mawps-72,Each child has 5 bottle caps.,"rate ( world , 5 , bottle cap , None , None , child , None , None )",,
mawps-72,"If there are 9 children,","container ( world , 9 , child , None , None )",Each child has 5 bottle caps.,"rate ( world , 5 , bottle cap , None , None , child , None , None )"
mawps-72,how many bottle caps are there in total?,"container ( world , None , bottle cap , None , None )","If there are 9 children,","container ( world , 9 , child , None , None )"
mawps-121,Melanie grew 139 turnips.,"container ( melanie , 139 , turnip , None , None )",,
mawps-121,Benny grew 113 turnips.,"container ( benny , 113 , turnip , None , None )",Melanie grew 139 turnips.,"container ( melanie , 139 , turnip , None , None )"
mawps-121,How many turnips did they grow in all?,"container ( they , None , turnip , None , None ) part ( they , turnip , None , None , melanie , turnip , None , None , benny , turnip , None , None )",Benny grew 113 turnips.,"container ( benny , 113 , turnip , None , None )"
mawps-336,Melanie picked 7 plums and 4 oranges from the orchard.,"container ( melanie , 7 , plum , None , None ) container ( melanie , 4 , orange , None , None )",,
mawps-336,She gave 3 plums to Sam.,"transfer ( sam , melanie , 3 , plum , None , None )",Melanie picked 7 plums and 4 oranges from the orchard.,"container ( melanie , 7 , plum , None , None ) container ( melanie , 4 , orange , None , None )"
mawps-336,How many plums does she have now?,"container ( melanie , None , plum , None , None )",She gave 3 plums to Sam.,"transfer ( sam , melanie , 3 , plum , None , None )"
mawps-361,Kaleb bought 14 boxes of chocolate candy and gave 5 to his little brother.,"container ( kaleb , 14 , chocolate candy , None , box ) transfer ( None , kaleb , 5 , chocolate candy , None , box )",,
mawps-361,"If each box has 6 pieces inside it,","container ( kaleb , None , chocolate candy , None , piece )",Kaleb bought 14 boxes of chocolate candy and gave 5 to his little brother.,"container ( kaleb , 14 , chocolate candy , None , box ) transfer ( None , kaleb , 5 , chocolate candy , None , box )"
mawps-361,how many pieces did Kaleb still have?,"rate ( kaleb , 6 , chocolate candy , None , piece , chocolate candy , None , box ) container ( kaleb , None , chocolate candy , None , piece )","If each box has 6 pieces inside it,","container ( kaleb , None , chocolate candy , None , piece )"
mawps-377,"Mary, Sam, Keith, and Alyssa each have 6 baseball cards.","container ( mary , 6 , card , baseball , None ) container ( sam , 6 , card , baseball , None ) container ( keith , 6 , card , baseball , None ) container ( alyssa , 6 , card , baseball , None )",,
mawps-377,How many baseball cards do they have in all?,"container ( all , None , card , baseball , None ) part ( all , card , baseball , None , mary , card , baseball , None , sam , card , baseball , None , keith , card , baseball , None , alyssa , card , baseball , None )","Mary, Sam, Keith, and Alyssa each have 6 baseball cards.","container ( mary , 6 , card , baseball , None ) container ( sam , 6 , card , baseball , None ) container ( keith , 6 , card , baseball , None ) container ( alyssa , 6 , card , baseball , None )"
mawps-48,For Halloween Bianca received 78 pieces of candy.,"container ( bianca , 78 , candy , None , piece )",,
mawps-48,She ate 30 pieces then placed the rest into piles with 8 in each pile.,"transfer ( None , bianca , 30 , candy , None , piece ) rate ( bianca , 8 , candy , None , piece , pile , None , None )",For Halloween Bianca received 78 pieces of candy.,"container ( bianca , 78 , candy , None , piece )"
mawps-48,How many piles could she make?,"container ( bianca , None , pile , None , None )",She ate 30 pieces then placed the rest into piles with 8 in each pile.,"transfer ( None , bianca , 30 , candy , None , piece ) rate ( bianca , 8 , candy , None , piece , pile , None , None )"
mawps-232,William has 10 marbles.,"container ( william , 10 , marble , None , None )",,
mawps-232,He shares 3 with Theresa.,"transfer ( theresa , william , 3 , marble , None , None )",William has 10 marbles.,"container ( william , 10 , marble , None , None )"
mawps-232,How many marbles will William have?,"container ( william , None , marble , None , None )",He shares 3 with Theresa.,"transfer ( theresa , william , 3 , marble , None , None )"
mawps-320,"Melanie, Benny, Sally, and Jessica each have 3 baseball cards.","container ( melanie , 3 , baseball card , None , None ) container ( benny , 3 , baseball card , None , None ) container ( sally , 3 , baseball card , None , None ) container ( jessica , 3 , baseball card , None , None )",,
mawps-320,How many baseball cards do they have in all?,"container ( they , None , baseball card , None , None ) part ( they , baseball card , None , None , melanie , baseball card , None , None , benny , baseball card , None , None , sally , baseball card , None , None , jessica , baseball card , None , None )","Melanie, Benny, Sally, and Jessica each have 3 baseball cards.","container ( melanie , 3 , baseball card , None , None ) container ( benny , 3 , baseball card , None , None ) container ( sally , 3 , baseball card , None , None ) container ( jessica , 3 , baseball card , None , None )"
mawps-459,The cafeteria had 50 apples.,"container ( cafeteria , 50 , apple , None , None )",,
mawps-459,For lunch they handed out 5 to students and decided to use the rest to make pies.,"transfer ( None , cafeteria , 5 , apple , student , None )",The cafeteria had 50 apples.,"container ( cafeteria , 50 , apple , None , None )"
